{
  "schemaVersion": 1,
  "kind": "composition",
  "scene": "main",
  "groups": [
    { "id": "lifeStages", "name": "Life stages" },
    { "id": "props", "name": "Care props", "transform": { "position": [0, 0, 1.2] } }
  ],
  "instances": [
    { "id": "room", "model": "petRoom", "name": "Room diorama", "transform": { "position": [0, 0, -0.6] } },
    { "id": "egg", "model": "petEgg", "parent": "lifeStages", "transform": { "position": [-1.6, 0, 0] } },
    { "id": "baby", "model": "petBaby", "parent": "lifeStages", "transform": { "position": [-0.8, 0, 0] } },
    { "id": "teen", "model": "petTeen", "parent": "lifeStages", "transform": { "position": [0, 0, 0] } },
    { "id": "adultBloom", "model": "petAdultBloom", "parent": "lifeStages", "transform": { "position": [0.9, 0, 0] } },
    { "id": "adultBramble", "model": "petAdultBramble", "parent": "lifeStages", "transform": { "position": [1.8, 0, 0] } },
    { "id": "bowl", "model": "petBowl", "parent": "props", "transform": { "position": [-1.6, 0, 0] } },
    { "id": "snack", "model": "petSnack", "parent": "props", "transform": { "position": [-1.1, 0, 0] } },
    { "id": "ball", "model": "petBall", "parent": "props", "transform": { "position": [-0.65, 0, 0] } },
    { "id": "bed", "model": "petBed", "parent": "props", "transform": { "position": [0, 0, 0] } },
    { "id": "mess", "model": "petPoop", "parent": "props", "transform": { "position": [0.6, 0, 0] } },
    { "id": "medicine", "model": "petMedicine", "parent": "props", "transform": { "position": [0.95, 0, 0] } },
    { "id": "bubbles", "model": "petBubbles", "parent": "props", "transform": { "position": [1.3, 0, 0] } },
    { "id": "heart", "model": "petHeart", "parent": "props", "transform": { "position": [1.65, 0.1, 0] } },
    { "id": "star", "model": "petStar", "parent": "props", "transform": { "position": [2.0, 0.1, 0] } }
  ]
}
